{
  "$schema": "../../schemas/reconstruction-interface-baseline.schema.json",
  "behavioral_reference_commit": "c348305bb9c6790141932ddf79f707e5223bb51c",
  "characterization_commit": "0ee607601187b7b4c34bb7ad8148321056c1a330",
  "generated_outputs": [
    {
      "path": ".devcontainer/Containerfile",
      "sha256": "7b8153ccddd492170bb24fa681500e38f9dba8b51b0585e75f5c2859ac16f423"
    },
    {
      "path": ".devcontainer/README.md",
      "sha256": "d81469d7dc6bb9fd9b9be10c347bb0c9ddac844860d28582a27947423c0a8839"
    },
    {
      "path": ".devcontainer/devcontainer.json",
      "sha256": "a133c50708c5a8b17666bc336c57703d60b9385c9d7c123faa0defc39797b56f"
    },
    {
      "path": ".github/CODEOWNERS",
      "sha256": "9e9e8c38887b9f43f1807e7d22e205bac6a808ea1f713e4ddb9e0becc00696b1"
    },
    {
      "path": ".github/ISSUE_TEMPLATE/bug_report.yml",
      "sha256": "e2d52ca86a52db8382ff91ec4a329e6308b8deb58a29117c81ad96c6c5946add"
    },
    {
      "path": ".github/ISSUE_TEMPLATE/config.yml",
      "sha256": "d3d5c775e20bd9fff7cf882592c916ac13a3b32c0b4e80f62374422026f4bb88"
    },
    {
      "path": ".github/ISSUE_TEMPLATE/device_qualification.yml",
      "sha256": "3efe8c3881a9403dd1103ba6027a66c2238eede8689cd69fac5e386d6150ac55"
    },
    {
      "path": ".github/ISSUE_TEMPLATE/documentation.yml",
      "sha256": "a8ad93bb61ab786a2e449853c619fe11774ab2b51f8253cb6fbac02dad2c59ea"
    },
    {
      "path": ".github/ISSUE_TEMPLATE/feature_request.yml",
      "sha256": "50f37f296981065597774f556e534ea13737f576d0b68c56d327ae88f81a51d9"
    },
    {
      "path": ".github/ISSUE_TEMPLATE/hardware_research.yml",
      "sha256": "5f71a1eb45eb4f6c10141c88621380065712e7ac017e75fbc58aaab6fac57df5"
    },
    {
      "path": ".github/dependabot.yml",
      "sha256": "73f898d685b651d31bc5efdb6d1f743204d4dabe32b55c2167f6ab5fc3146e8a"
    },
    {
      "path": ".github/pull_request_template.md",
      "sha256": "b0dbdfe8d4b7bc1713439646769017266210a4e0c2401d807961c12858317763"
    },
    {
      "path": ".github/release.yml",
      "sha256": "adcecc9f00dcc821d63d98ac1585af6a5c20b80c537f3e3f4f2335b2dc99c0d0"
    },
    {
      "path": ".github/workflows/codeql.yml",
      "sha256": "0edaae06da6d1e4cce18c93ae465cd647b93aa425d365664bb3f0d214500d97c"
    },
    {
      "path": ".github/workflows/dependency-review.yml",
      "sha256": "b234c299c54e86783cbac71d2254d1d6409a2cd11236706b4220fe2f408a7c8f"
    },
    {
      "path": ".github/workflows/full-verification.yml",
      "sha256": "ab36615d7b70a969a1365f397b6c8820291f66391c22dcd19267a008f8572921"
    },
    {
      "path": ".github/workflows/verification.yml",
      "sha256": "ddb5c47593b21a1e5101b738c4cef7c2f587647cfdda903ca71ddb54693c6524"
    },
    {
      "path": "LICENSES/README.md",
      "sha256": "cdf92616d48814ecf9cbebcd6177da5eb4dc88aa4db4bf05a319bbc811973867"
    },
    {
      "path": "README.md",
      "sha256": "749b8e66ac6781ae11c69083666f15fdac75c444a41cbae5fba8231289bbaba0"
    },
    {
      "path": "apps/README.md",
      "sha256": "c10c5ae059f92a33b3ae7048222457002c465bd1c210bfcdbdc736850f0c2c18"
    },
    {
      "path": "apps/device-qualification/README.md",
      "sha256": "2b8cd0a0b623a8a8b4d10c9b7400a8cfdf087d32089a5d8ef2ea896f2f05a00c"
    },
    {
      "path": "architecture/README.md",
      "sha256": "058ed5c1bf0ac567f9b6fe774bdd48334872498eb9384d2459e5cdbd05fb80bd"
    },
    {
      "path": "assurance/README.md",
      "sha256": "072141b14a585b87cb6c6c06c556f5c3ce54004898adf03c3c7a44eb44c0e3af"
    },
    {
      "path": "assurance/generated/hyperflux-next.spdx.json",
      "sha256": "6ec77fb45aa3af2ac1acb2897acda6c36a8c5ba1f6500310b81e6a191b800037"
    },
    {
      "path": "crates/README.md",
      "sha256": "8e47f3d13624f17494f7a718698b624abf7c0f9049a4201f33da7ec68902648e"
    },
    {
      "path": "crates/hfx-bridge/README.md",
      "sha256": "0aced479c3cc3409e6a37816125af0f4fd430ec4472ad94615b961c214e62ba3"
    },
    {
      "path": "crates/hfx-core/README.md",
      "sha256": "aef973cd355d84dfb00a01d6175436641229f256b156c222757e4727bb195ebe"
    },
    {
      "path": "crates/hfx-daemon/README.md",
      "sha256": "27e9b97a3df87bb3953e4d14deed46021c82399fe77c915790f8074d9b063f7d"
    },
    {
      "path": "crates/hfx-domain/src/generated.rs",
      "sha256": "8fcd640996d6ce048be37416ae4c4323a5a2f8c1a82dd658f8025c78d1ee7dbc"
    },
    {
      "path": "crates/hfx-errors/src/generated.rs",
      "sha256": "5e3f2194430dc2a2ebbe71c9d5765c41623e52076f84175d7ef159ab16d0741a"
    },
    {
      "path": "crates/hfx-integration-model/src/generated.rs",
      "sha256": "2ca17404ef96b46754cdae7e017a36c46758e73e69a3b059ae5f78215c1c2e3e"
    },
    {
      "path": "crates/hfx-integration-model/src/openrazer_native_generated.rs",
      "sha256": "d3605bd02f4ab43937efdfdf4e7fb6b14a58fb46024549334bc4ab1bb81a8c2b"
    },
    {
      "path": "crates/hfx-kernel-transport/README.md",
      "sha256": "276e4a6e6e8ad5b882fe9823b2d7637a873267da0a218a697fb30136a83ef49c"
    },
    {
      "path": "crates/hfx-kernel-transport/src/generated.rs",
      "sha256": "3662e214163871a0c3bef7de5b4f440d8cd784af338f78f24c16913a2c444419"
    },
    {
      "path": "crates/hfx-ops/README.md",
      "sha256": "9d5ce6bdd1f0f5a17f19e3237e4af5e3d2e91dead83eaf7d31b6cf5c18c09ada"
    },
    {
      "path": "crates/hfx-profiles/src/generated.rs",
      "sha256": "6325e84e28c572b8306a1728bcc1ba487181e4e7738d3abffbdfe1dbe470ce19"
    },
    {
      "path": "crates/hfx-protocol/src/generated.rs",
      "sha256": "0d5a91164a782205359b3490dc49c22ecb92d00b570cdf06e372fab7f994743a"
    },
    {
      "path": "crates/hfx-protocol/src/generated_v1.rs",
      "sha256": "26f1cb6ab6f262c465a820357a0b425330b3d1943d03ddaca657e6d2f52184fd"
    },
    {
      "path": "crates/hfx-protocol/src/generated_v2.rs",
      "sha256": "e475a55c67bf33557603a0607614284398b685001a49f65c1a75be7fbba85e09"
    },
    {
      "path": "crates/hfx-protocol/src/generated_v3.rs",
      "sha256": "2517f9de0feaf16d63296f1f86e7a92037da725677ab8def28debc971522c57a"
    },
    {
      "path": "crates/hfx-protocol/src/generated_v4.rs",
      "sha256": "0a9e449bb2def94caf182d1839950122bdf9493bf39554bd0214eb2c658d3f28"
    },
    {
      "path": "crates/hfx-protocol/src/generated_v5.rs",
      "sha256": "d3f51982f780371391aa90c3332745e5fa64afc08e3ec59e6914dd61b0f379c7"
    },
    {
      "path": "crates/hfx-protocol/src/generated_v6.rs",
      "sha256": "bfcb3c8f3d5451649b24932a30e2cc73070147909fc25f01925337ff60815cb6"
    },
    {
      "path": "crates/hfx-protocol/src/generated_v7.rs",
      "sha256": "0d5a91164a782205359b3490dc49c22ecb92d00b570cdf06e372fab7f994743a"
    },
    {
      "path": "crates/hfx-protocol/src/generated_versions.rs",
      "sha256": "bf627ead534238c3a679f547ea07584c0b1080db5adabf644462d4a37cee47ed"
    },
    {
      "path": "crates/hfx-runtime/src/generated.rs",
      "sha256": "9af09992cf47d38352c94f3880845c085641b33a3422945cf973f3c6b0e661c6"
    },
    {
      "path": "crates/hfx-sdk/README.md",
      "sha256": "40988ddb2ebafc4c0c59c73020eabfbd4620c71f89d318b3873b23034d22c6a9"
    },
    {
      "path": "crates/hfx-sim/README.md",
      "sha256": "9b119a31d072ea2fbf4580b6d3d1fe6b65f0650e456c609cd0d1c49d1128bfda"
    },
    {
      "path": "docs/README.md",
      "sha256": "d2caa312d525ebe38ab9d0365a1648087f10207fc2bce7944b1262401a4c7a42"
    },
    {
      "path": "docs/assets/badge-license.svg",
      "sha256": "2e8ebff2210d005c7c32f7d5cfead85eef0c1e65723d4c877b14e74d999739b3"
    },
    {
      "path": "docs/assets/badge-state.svg",
      "sha256": "cb9970295c4ea65d71dfb59f8fc6bc1268ccb9df61c69d62db934c08d059444c"
    },
    {
      "path": "docs/assets/social-preview.png",
      "sha256": "784b49b57d82b486a803125c636d173c5888544840faedb18cfe4e3b0c59f6b3"
    },
    {
      "path": "docs/generated/architecture.md",
      "sha256": "c546eff99cd57aba7431fbba205e52c2b121bb2f7e3c7de39b50f650c6750e35"
    },
    {
      "path": "docs/generated/bridge-protocol-v1.md",
      "sha256": "0e1a94c429e7ca19bdba1c3d2d6066cb8401d6dd713c618eb0c49875391c0015"
    },
    {
      "path": "docs/generated/bridge-protocol-v2.md",
      "sha256": "0b3e31ea30648cf9f258dd61a0817952b18d335e8cff02bb7b218456d4213cda"
    },
    {
      "path": "docs/generated/bridge-protocol-v3.md",
      "sha256": "2b0c04f7341ecf115f7875681602a544d86f3d45f19abc7216a8f275ca048591"
    },
    {
      "path": "docs/generated/bridge-protocol-v4.md",
      "sha256": "f0e33323db5bcfa95039a4d2da079d789aca4128c6141ef47c47e66c5c6a6259"
    },
    {
      "path": "docs/generated/bridge-protocol-v5.md",
      "sha256": "481406f918f16b111c5503861d017a24940dfc3a4cfbb7c0ccdc9ff572a9c107"
    },
    {
      "path": "docs/generated/bridge-protocol-v6.md",
      "sha256": "8305df9323136d4e8678f4a0d107a338fc9651da222fdc2aad66ed19985c5188"
    },
    {
      "path": "docs/generated/bridge-protocol-v7.md",
      "sha256": "31a0abb5eea86590905fcce5ad54a8b002404ba3cb03587ce43ba15bf3c9dc5f"
    },
    {
      "path": "docs/generated/bridge-protocol.md",
      "sha256": "8c43e50d548547a456ca9882974accdf7a1ca8c2258f71ee32de96f3354cab66"
    },
    {
      "path": "docs/generated/design-coverage.md",
      "sha256": "929f666e6c823dc7a17d2d396003a44625961161b1f30ff3379cc279eaf0039d"
    },
    {
      "path": "docs/generated/development-environment.md",
      "sha256": "00681ba5bf6f1cf9aa97e3a3e75d5c1521fb1be64da96bbdc7febfc4f78cd8fc"
    },
    {
      "path": "docs/generated/device-knowledge.md",
      "sha256": "2a44e3eb165ae3a3a6de2bb22d780d7eb5718e24bafaa671bda902de59c110d0"
    },
    {
      "path": "docs/generated/distributions.md",
      "sha256": "01b82bff2007896636822f06b3b4b65c5e40157c3008daf8ab35338f3230417e"
    },
    {
      "path": "docs/generated/domain-types.md",
      "sha256": "b6b82d7b06d032238d91dc2341bb4cf1cff9f6a5cf8e354a50f1b0c6e659ab6b"
    },
    {
      "path": "docs/generated/error-catalog.md",